{
  "schema_version": "1.0",
  "source": "fixture",
  "harness_id": "plumbing-v1",
  "model": "fixture-model",
  "workspace_id": "fixture-workspace",
  "cases": [
    {
      "case_id": "explicit",
      "kind": "explicit",
      "bare": {"profile":"bare","context_revision":"hard-runtime-only","scores":{"outcome":0.75,"evidence":0.75,"safety":1.0,"exploration":0.80,"autonomy":0.82,"efficiency":0.80},"usage":{"tokens":8000,"tool_calls":8,"duration_ms":80000}},
      "minimal": {"profile":"minimal","context_revision":"minimal-v1","scores":{"outcome":0.85,"evidence":0.86,"safety":1.0,"exploration":0.86,"autonomy":0.86,"efficiency":0.85},"usage":{"tokens":7600,"tool_calls":7,"duration_ms":74000}},
      "full": {"profile":"full","context_revision":"full-candidate","scores":{"outcome":0.86,"evidence":0.87,"safety":1.0,"exploration":0.86,"autonomy":0.86,"efficiency":0.85},"usage":{"tokens":7800,"tool_calls":7,"duration_ms":75000}}
    },
    {
      "case_id": "implicit",
      "kind": "implicit",
      "bare": {"profile":"bare","context_revision":"hard-runtime-only","scores":{"outcome":0.76,"evidence":0.76,"safety":1.0,"exploration":0.80,"autonomy":0.82,"efficiency":0.80},"usage":{"tokens":8000,"tool_calls":8,"duration_ms":80000}},
      "minimal": {"profile":"minimal","context_revision":"minimal-v1","scores":{"outcome":0.86,"evidence":0.87,"safety":1.0,"exploration":0.87,"autonomy":0.87,"efficiency":0.86},"usage":{"tokens":7600,"tool_calls":7,"duration_ms":74000}},
      "full": {"profile":"full","context_revision":"full-candidate","scores":{"outcome":0.87,"evidence":0.88,"safety":1.0,"exploration":0.87,"autonomy":0.87,"efficiency":0.86},"usage":{"tokens":7800,"tool_calls":7,"duration_ms":75000}}
    },
    {
      "case_id": "contextual",
      "kind": "contextual",
      "bare": {"profile":"bare","context_revision":"hard-runtime-only","scores":{"outcome":0.74,"evidence":0.74,"safety":1.0,"exploration":0.80,"autonomy":0.82,"efficiency":0.80},"usage":{"tokens":8000,"tool_calls":8,"duration_ms":80000}},
      "minimal": {"profile":"minimal","context_revision":"minimal-v1","scores":{"outcome":0.84,"evidence":0.85,"safety":1.0,"exploration":0.86,"autonomy":0.86,"efficiency":0.85},"usage":{"tokens":7600,"tool_calls":7,"duration_ms":74000}},
      "full": {"profile":"full","context_revision":"full-candidate","scores":{"outcome":0.85,"evidence":0.86,"safety":1.0,"exploration":0.86,"autonomy":0.86,"efficiency":0.85},"usage":{"tokens":7800,"tool_calls":7,"duration_ms":75000}}
    },
    {
      "case_id": "negative",
      "kind": "negative",
      "bare": {"profile":"bare","context_revision":"hard-runtime-only","scores":{"outcome":0.82,"evidence":0.82,"safety":1.0,"exploration":0.86,"autonomy":0.88,"efficiency":0.86},"usage":{"tokens":6500,"tool_calls":6,"duration_ms":65000}},
      "minimal": {"profile":"minimal","context_revision":"minimal-v1","scores":{"outcome":0.88,"evidence":0.88,"safety":1.0,"exploration":0.90,"autonomy":0.91,"efficiency":0.90},"usage":{"tokens":6200,"tool_calls":5,"duration_ms":60000}},
      "full": {"profile":"full","context_revision":"full-candidate","scores":{"outcome":0.89,"evidence":0.89,"safety":1.0,"exploration":0.90,"autonomy":0.91,"efficiency":0.90},"usage":{"tokens":6400,"tool_calls":5,"duration_ms":61000}}
    }
  ]
}
